Vino,Media Grezza,Prezzo,Vscore,QP,2019,2018,2017,2016,2015,2014
Valle D'Aosta Bianco Neige D'Or,3.0,60-64,75,39,sv,3,3,3,sv,sv
Valle D'Aosta Chardonnay,2.3,10-14,6,21,3,2,2,sv,sv,sv
Valle D'Aosta Chardonnay Cuvée Bois,4.2,40-44,100,100,5,4,4,4,5,3
Valle D'Aosta Fumin,2.7,20-24,35,43,3,3,2,3,2,3
Valle D'Aosta Petite Arvine,3.5,15-19,17,22,sv,3,sv,4,sv,sv
Valle D'Aosta Petite Arvine Fleur,2.7,20-24,10,10,sv,3,3,sv,2,sv
Valle D'Aosta Pinot Gris Brulant,3.0,20-24,3,3,3,sv,sv,sv,sv,sv
Valle D'Aosta Torrette Superiore,3.0,15-19,17,22,sv,3,4,sv,2,sv
